No.     Time           Source                Destination           Protocol Length Info
      4 0.297536000    192.168.11.11         220.181.105.250       HTTP     315    GET /data/brfversion.xml HTTP/1.1 

Frame 4: 315 bytes on wire (2520 bits), 315 bytes captured (2520 bits) on interface 0
Ethernet II, Src: Promax_15:8c:1b (00:e0:66:15:8c:1b), Dst: 20:dc:e6:cb:69:5e (20:dc:e6:cb:69:5e)
Internet Protocol Version 4, Src: 192.168.11.11 (192.168.11.11), Dst: 220.181.105.250 (220.181.105.250)
Transmission Control Protocol, Src Port: aises (2783), Dst Port: http (80), Seq: 1, Ack: 1, Len: 261
    Source port: aises (2783)
    Destination port: http (80)
    [Stream index: 0]
    Sequence number: 1    (relative sequence number)
    [Next sequence number: 262    (relative sequence number)]
    Acknowledgment number: 1    (relative ack number)
    Header length: 20 bytes
    Flags: 0x018 (PSH, ACK)
    Window size value: 16560
    [Calculated window size: 66240]
    [Window size scaling factor: 4]
    Checksum: 0x0c8b [validation disabled]
    [SEQ/ACK analysis]
Hypertext Transfer Protocol
    GET /data/brfversion.xml HTTP/1.1\r\n
    Connection: Close\r\n
    Accept: text/html,application/xhtml+xml,application/xml;q=0.9,*/*;q=0.8\r\n
    User-Agent: Mozilla/4.0 (compatible; MSIE 7.0; Windows NT 5.1;Miser Report)\r\n
    Host: miserupdate.aliyun.com\r\n
    Cache-Control: no-cache\r\n
    \r\n
    [Full request URI: http://miserupdate.aliyun.com/data/brfversion.xml]

No.     Time           Source                Destination           Protocol Length Info
      6 0.674199000    220.181.105.250       192.168.11.11         HTTP/XML 705    HTTP/1.1 200 OK 

Frame 6: 705 bytes on wire (5640 bits), 705 bytes captured (5640 bits) on interface 0
Ethernet II, Src: 20:dc:e6:cb:69:5e (20:dc:e6:cb:69:5e), Dst: Promax_15:8c:1b (00:e0:66:15:8c:1b)
Internet Protocol Version 4, Src: 220.181.105.250 (220.181.105.250), Dst: 192.168.11.11 (192.168.11.11)
Transmission Control Protocol, Src Port: http (80), Dst Port: aises (2783), Seq: 1, Ack: 262, Len: 651
    Source port: http (80)
    Destination port: aises (2783)
    [Stream index: 0]
    Sequence number: 1    (relative sequence number)
    [Next sequence number: 652    (relative sequence number)]
    Acknowledgment number: 262    (relative ack number)
    Header length: 20 bytes
    Flags: 0x011 (FIN, ACK)
    Window size value: 31
    [Calculated window size: 15872]
    [Window size scaling factor: 512]
    Checksum: 0xe54e [validation disabled]
    [SEQ/ACK analysis]
Hypertext Transfer Protocol
    HTTP/1.1 200 OK\r\n
    Date: Tue, 02 Apr 2013 01:41:05 GMT\r\n
    Server: Apache/2.2.22 (Unix) PHP/5.3.10\r\n
    Last-Modified: Tue, 02 Apr 2013 01:37:46 GMT\r\n
    ETag: "a878003-c0-4d956c8caee80"\r\n
    Accept-Ranges: bytes\r\n
    Content-Length: 192\r\n
    Cache-Control: max-age=600\r\n
    Expires: Tue, 02 Apr 2013 01:51:05 GMT\r\n
    Content-Type: application/xml\r\n
    Age: 272\r\n
    Via: http/1.1 l2cn8 (ApacheTrafficServer/3.0.2 [cRs f ]), http/1.1 cn125 (ApacheTrafficServer/3.0.2 [cRs f ])\r\n
    Connection: close\r\n
    \r\n
eXtensible Markup Language

No.     Time           Source                Destination           Protocol Length Info
     11 4.431300000    101.226.4.234         192.168.11.11         HTTP     88     HTTP/1.1 200 OK  (text/plain)

Frame 11: 88 bytes on wire (704 bits), 88 bytes captured (704 bits) on interface 0
Ethernet II, Src: 20:dc:e6:cb:69:5e (20:dc:e6:cb:69:5e), Dst: Promax_15:8c:1b (00:e0:66:15:8c:1b)
Internet Protocol Version 4, Src: 101.226.4.234 (101.226.4.234), Dst: 192.168.11.11 (192.168.11.11)
Transmission Control Protocol, Src Port: http (80), Dst Port: everydayrc (2782), Seq: 134, Ack: 1, Len: 34
    Source port: http (80)
    Destination port: everydayrc (2782)
    [Stream index: 1]
    Sequence number: 134    (relative sequence number)
    [Next sequence number: 168    (relative sequence number)]
    Acknowledgment number: 1    (relative ack number)
    Header length: 20 bytes
    Flags: 0x019 (FIN, PSH, ACK)
    Window size value: 23
    [Calculated window size: 23]
    [Window size scaling factor: -1 (unknown)]
    Checksum: 0xaf27 [validation disabled]
    [SEQ/ACK analysis]
    TCP segment data (34 bytes)
[2 Reassembled TCP Segments (167 bytes): #10(133), #11(34)]
Hypertext Transfer Protocol
    HTTP/1.1 200 OK\r\n
    Server: 360CometWebServer 1.0\r\n
    Date: Tue, 02 Apr 2013 01:45:41 GMT\r\n
    Content-Type: text/plain\r\n
    Content-Length: 34\r\n
    \r\n
Line-based text data: text/plain

No.     Time           Source                Destination           Protocol Length Info
     18 4.609618000    192.168.11.11         101.226.4.234         HTTP     359    GET /ClientPush/poll?qid=215587461&devid=ec340841cd2f2c0cc8f97d91ae2d00ad&ver=26062&rtick=3276658& HTTP/1.1 

Frame 18: 359 bytes on wire (2872 bits), 359 bytes captured (2872 bits) on interface 0
Ethernet II, Src: Promax_15:8c:1b (00:e0:66:15:8c:1b), Dst: 20:dc:e6:cb:69:5e (20:dc:e6:cb:69:5e)
Internet Protocol Version 4, Src: 192.168.11.11 (192.168.11.11), Dst: 101.226.4.234 (101.226.4.234)
Transmission Control Protocol, Src Port: www-dev (2784), Dst Port: http (80), Seq: 1, Ack: 1, Len: 305
    Source port: www-dev (2784)
    Destination port: http (80)
    [Stream index: 2]
    Sequence number: 1    (relative sequence number)
    [Next sequence number: 306    (relative sequence number)]
    Acknowledgment number: 1    (relative ack number)
    Header length: 20 bytes
    Flags: 0x018 (PSH, ACK)
    Window size value: 16560
    [Calculated window size: 66240]
    [Window size scaling factor: 4]
    Checksum: 0x35a6 [validation disabled]
    [SEQ/ACK analysis]
Hypertext Transfer Protocol
    GET /ClientPush/poll?qid=215587461&devid=ec340841cd2f2c0cc8f97d91ae2d00ad&ver=26062&rtick=3276658& HTTP/1.1\r\n
    Accept: */*\r\n
    User-Agent: box/1.8.7.1195\r\n
    Cookie: token=3074118130.17.8f66ffbd.215587461.1364864477; \r\n
    Connection: Close\r\n
    Accept-Encoding: gzip\r\n
    Host: p17.yunpan.360.cn\r\n
    Cache-Control: no-cache\r\n
    \r\n
    [Full request URI: http://p17.yunpan.360.cn/ClientPush/poll?qid=215587461&devid=ec340841cd2f2c0cc8f97d91ae2d00ad&ver=26062&rtick=3276658&]

No.     Time           Source                Destination           Protocol Length Info
     23 17.239634000   192.168.11.11         101.226.89.41         HTTP     358    POST /analytics/upload HTTP/1.1 

Frame 23: 358 bytes on wire (2864 bits), 358 bytes captured (2864 bits) on interface 0
Ethernet II, Src: Promax_15:8c:1b (00:e0:66:15:8c:1b), Dst: 20:dc:e6:cb:69:5e (20:dc:e6:cb:69:5e)
Internet Protocol Version 4, Src: 192.168.11.11 (192.168.11.11), Dst: 101.226.89.41 (101.226.89.41)
Transmission Control Protocol, Src Port: aic-np (2785), Dst Port: http (80), Seq: 1, Ack: 1, Len: 304
    Source port: aic-np (2785)
    Destination port: http (80)
    [Stream index: 3]
    Sequence number: 1    (relative sequence number)
    [Next sequence number: 305    (relative sequence number)]
    Acknowledgment number: 1    (relative ack number)
    Header length: 20 bytes
    Flags: 0x018 (PSH, ACK)
    Window size value: 64800
    [Calculated window size: 64800]
    [Window size scaling factor: -2 (no window scaling used)]
    Checksum: 0x1402 [validation disabled]
    [SEQ/ACK analysis]
Hypertext Transfer Protocol
    POST /analytics/upload HTTP/1.1\r\n
    Content-Length: 199\r\n
    Host: monitor.uu.qq.com\r\n
    Connection: Keep-Alive\r\n
    \r\n
    [Full request URI: http://monitor.uu.qq.com/analytics/upload]
    Data (199 bytes)

0000  00 00 00 c7 10 02 2c 3c 40 01 56 04 74 65 73 74   ......,<@.V.test
0010  66 04 74 65 73 74 7d 00 01 00 a7 08 00 01 06 06   f.test}.........
0020  64 65 74 61 69 6c 18 00 01 06 15 63 6f 6d 6d 6f   detail.....commo
0030  6e 2e 52 65 71 75 65 73 74 50 61 63 6b 61 67 65   n.RequestPackage
0040  1d 00 00 7e 0a 00 01 16 11 63 6f 6d 2e 74 65 6e   ...~.....com.ten
0050  63 65 6e 74 2e 74 6f 6b 65 6e 26 06 31 2e 35 2e   cent.token&.1.5.
0060  31 38 36 14 63 6f 6d 2e 74 65 6e 63 65 6e 74 2e   186.com.tencent.
0070  66 65 65 64 62 61 63 6b 46 15 72 71 64 5f 31 2e   feedbackF.rqd_1.
0080  33 2e 35 5f 61 64 64 55 69 64 54 6f 45 75 70 5c   3.5_addUidToEup\
0090  6d 00 0c 76 17 73 64 6b 3b 41 6e 64 72 6f 69 64   m..v.sdk;Android
00a0  20 32 2e 32 2c 6c 65 76 65 6c 20 38 86 0a 74 65    2.2,level 8..te
00b0  73 74 55 73 65 72 49 64 90 ff a0 ff b6 01 35 c6   stUserId......5.
00c0  00 0b 8c 98 0c a8 0c                              .......

No.     Time           Source                Destination           Protocol Length Info
     25 17.393410000   101.226.89.41         192.168.11.11         HTTP     451    HTTP/1.1 200 OK 

Frame 25: 451 bytes on wire (3608 bits), 451 bytes captured (3608 bits) on interface 0
Ethernet II, Src: 20:dc:e6:cb:69:5e (20:dc:e6:cb:69:5e), Dst: Promax_15:8c:1b (00:e0:66:15:8c:1b)
Internet Protocol Version 4, Src: 101.226.89.41 (101.226.89.41), Dst: 192.168.11.11 (192.168.11.11)
Transmission Control Protocol, Src Port: http (80), Dst Port: aic-np (2785), Seq: 1, Ack: 305, Len: 397
    Source port: http (80)
    Destination port: aic-np (2785)
    [Stream index: 3]
    Sequence number: 1    (relative sequence number)
    [Next sequence number: 398    (relative sequence number)]
    Acknowledgment number: 305    (relative ack number)
    Header length: 20 bytes
    Flags: 0x018 (PSH, ACK)
    Window size value: 6432
    [Calculated window size: 6432]
    [Window size scaling factor: -2 (no window scaling used)]
    Checksum: 0x3b05 [validation disabled]
    [SEQ/ACK analysis]
Hypertext Transfer Protocol
    HTTP/1.1 200 OK\r\n
    Server: HTTP Load Balancer/1.0\r\n
    Content-Length: 245\r\n
    Date: Tue, 02 Apr 2013 01:45:54 GMT\r\n
    Cache-Control: no-cache\r\n
    Pragma: no-cache\r\n
    \r\n
    Data (245 bytes)

0000  00 00 00 f5 10 02 2c 3c 40 01 56 0c 75 70 6c 6f   ......,<@.V.uplo
0010  61 64 53 65 72 76 65 72 66 09 61 6e 61 6c 79 74   adServerf.analyt
0020  69 63 73 7d 00 01 00 c8 08 00 01 06 06 64 65 74   ics}.........det
0030  61 69 6c 18 00 01 06 16 63 6f 6d 6d 6f 6e 2e 52   ail.....common.R
0040  65 73 70 6f 6e 73 65 50 61 63 6b 61 67 65 1d 00   esponsePackage..
0050  01 00 9d 0a 0c 10 0a 2d 00 00 78 5b 4d 2e cd c8   .......-..x[M...
0060  c3 4c fe f9 b2 76 f2 1e af 38 89 2b 0b 0e b7 2a   .L...v...8.+...*
0070  3f b5 e0 2c 3e 20 ae 0a 15 4c c1 e8 4d e3 1f 91   ?..,> ...L..M...
0080  50 04 c7 47 a4 32 19 d6 37 23 eb 17 61 b8 12 06   P..G.2..7#..a...
0090  3c 46 9c 37 ec b9 a6 78 43 13 02 76 c6 76 ba ef   <F.7...xC..v.v..
00a0  00 02 21 84 14 38 d3 bb 01 59 8e 44 0a cf 4e 0b   ..!..8...Y.D..N.
00b0  58 7d 1e 93 3b 71 72 40 d1 bd 7f 5e b1 55 7d d4   X}..;qr@...^.U}.
00c0  f9 25 57 eb a0 e2 94 16 a4 3a 3c 39 72 23 6a 38   .%W......:<9r#j8
00d0  b2 51 d8 36 0d 31 38 33 2e 35 39 2e 38 31 2e 32   .Q.6.183.59.81.2
00e0  34 32 40 01 50 02 63 00 00 01 3d c8 6c 02 c7 0b   42@.P.c...=.l...
00f0  8c 98 0c a8 0c                                    .....

No.     Time           Source                Destination           Protocol Length Info
     33 20.553168000   192.168.11.11         119.147.15.37         HTTP     271    GET /cn/mbtoken3/mbtoken3_qry_update_info?mobile_type=4&client_type=2&client_ver=15&local_id=0 HTTP/1.1 

Frame 33: 271 bytes on wire (2168 bits), 271 bytes captured (2168 bits) on interface 0
Ethernet II, Src: Promax_15:8c:1b (00:e0:66:15:8c:1b), Dst: 20:dc:e6:cb:69:5e (20:dc:e6:cb:69:5e)
Internet Protocol Version 4, Src: 192.168.11.11 (192.168.11.11), Dst: 119.147.15.37 (119.147.15.37)
Transmission Control Protocol, Src Port: aic-oncrpc (2786), Dst Port: http (80), Seq: 1, Ack: 1, Len: 217
    Source port: aic-oncrpc (2786)
    Destination port: http (80)
    [Stream index: 4]
    Sequence number: 1    (relative sequence number)
    [Next sequence number: 218    (relative sequence number)]
    Acknowledgment number: 1    (relative ack number)
    Header length: 20 bytes
    Flags: 0x018 (PSH, ACK)
    Window size value: 16560
    [Calculated window size: 66240]
    [Window size scaling factor: 4]
    Checksum: 0xaaf7 [validation disabled]
    [SEQ/ACK analysis]
Hypertext Transfer Protocol
    GET /cn/mbtoken3/mbtoken3_qry_update_info?mobile_type=4&client_type=2&client_ver=15&local_id=0 HTTP/1.1\r\n
    User-Agent: Dalvik/1.2.0 (Linux; U; Android 2.2; sdk Build/FRF91)\r\n
    Host: w.aq.qq.com\r\n
    Connection: Keep-Alive\r\n
    \r\n
    [Full request URI: http://w.aq.qq.com/cn/mbtoken3/mbtoken3_qry_update_info?mobile_type=4&client_type=2&client_ver=15&local_id=0]

No.     Time           Source                Destination           Protocol Length Info
     36 20.893330000   119.147.15.37         192.168.11.11         HTTP     60     HTTP/1.1 200 OK  (application/json)

Frame 36: 60 bytes on wire (480 bits), 60 bytes captured (480 bits) on interface 0
Ethernet II, Src: 20:dc:e6:cb:69:5e (20:dc:e6:cb:69:5e), Dst: Promax_15:8c:1b (00:e0:66:15:8c:1b)
Internet Protocol Version 4, Src: 119.147.15.37 (119.147.15.37), Dst: 192.168.11.11 (192.168.11.11)
Transmission Control Protocol, Src Port: http (80), Dst Port: aic-oncrpc (2786), Seq: 413, Ack: 218, Len: 5
    Source port: http (80)
    Destination port: aic-oncrpc (2786)
    [Stream index: 4]
    Sequence number: 413    (relative sequence number)
    [Next sequence number: 418    (relative sequence number)]
    Acknowledgment number: 218    (relative ack number)
    Header length: 20 bytes
    Flags: 0x018 (PSH, ACK)
    Window size value: 27
    [Calculated window size: 6912]
    [Window size scaling factor: 256]
    Checksum: 0x433f [validation disabled]
    [SEQ/ACK analysis]
    TCP segment data (5 bytes)
[2 Reassembled TCP Segments (417 bytes): #35(412), #36(5)]
Hypertext Transfer Protocol
    HTTP/1.1 200 OK\r\n
    Date: Tue, 02 Apr 2013 01:45:57 GMT\r\n
    Server: Apache\r\n
    Set-Cookie: aq_base_sid=ZpE3mHReFAQYn7TuQInK36c5GyV9rISZ; PATH=/; DOMAIN=w.aq.qq.com;HttpOnly;\r\n
    Keep-Alive: timeout=5, max=100\r\n
    Connection: Keep-Alive\r\n
    Transfer-Encoding: chunked\r\n
    Content-Type: application/json; charset=utf-8\r\n
    \r\n
    HTTP chunked response
JavaScript Object Notation: application/json

No.     Time           Source                Destination           Protocol Length Info
     38 21.270800000   192.168.11.11         119.147.15.37         HTTP     435    GET /cn/mbtoken3/mbtoken3_exchange_key_v2?mobile_type=4&client_type=2&client_ver=15&local_id=0&config_ver=100&pub_key=6C9A8586B18C243E4C673292003FFD009A76D0AEB33E7B9A594434BCC0277F5755F1F37E24C48F463E46557B01D6180306EF93908327AC69D72CECE5274038B0&sys_ver=2.2 HTTP/1.1 

Frame 38: 435 bytes on wire (3480 bits), 435 bytes captured (3480 bits) on interface 0
Ethernet II, Src: Promax_15:8c:1b (00:e0:66:15:8c:1b), Dst: 20:dc:e6:cb:69:5e (20:dc:e6:cb:69:5e)
Internet Protocol Version 4, Src: 192.168.11.11 (192.168.11.11), Dst: 119.147.15.37 (119.147.15.37)
Transmission Control Protocol, Src Port: aic-oncrpc (2786), Dst Port: http (80), Seq: 218, Ack: 418, Len: 381
    Source port: aic-oncrpc (2786)
    Destination port: http (80)
    [Stream index: 4]
    Sequence number: 218    (relative sequence number)
    [Next sequence number: 599    (relative sequence number)]
    Acknowledgment number: 418    (relative ack number)
    Header length: 20 bytes
    Flags: 0x018 (PSH, ACK)
    Window size value: 16455
    [Calculated window size: 65820]
    [Window size scaling factor: 4]
    Checksum: 0xc85f [validation disabled]
    [SEQ/ACK analysis]
Hypertext Transfer Protocol
    [truncated] GET /cn/mbtoken3/mbtoken3_exchange_key_v2?mobile_type=4&client_type=2&client_ver=15&local_id=0&config_ver=100&pub_key=6C9A8586B18C243E4C673292003FFD009A76D0AEB33E7B9A594434BCC0277F5755F1F37E24C48F463E46557B01D6180306EF93908327A
    User-Agent: Dalvik/1.2.0 (Linux; U; Android 2.2; sdk Build/FRF91)\r\n
    Host: w.aq.qq.com\r\n
    Connection: Keep-Alive\r\n
    \r\n
    [Full request URI [truncated]: http://w.aq.qq.com/cn/mbtoken3/mbtoken3_exchange_key_v2?mobile_type=4&client_type=2&client_ver=15&local_id=0&config_ver=100&pub_key=6C9A8586B18C243E4C673292003FFD009A76D0AEB33E7B9A594434BCC0277F5755F1F37E24C48]

No.     Time           Source                Destination           Protocol Length Info
     40 21.666263000   119.147.15.37         192.168.11.11         HTTP     60     HTTP/1.1 200 OK  (application/json)

Frame 40: 60 bytes on wire (480 bits), 60 bytes captured (480 bits) on interface 0
Ethernet II, Src: 20:dc:e6:cb:69:5e (20:dc:e6:cb:69:5e), Dst: Promax_15:8c:1b (00:e0:66:15:8c:1b)
Internet Protocol Version 4, Src: 119.147.15.37 (119.147.15.37), Dst: 192.168.11.11 (192.168.11.11)
Transmission Control Protocol, Src Port: http (80), Dst Port: aic-oncrpc (2786), Seq: 1125, Ack: 599, Len: 5
    Source port: http (80)
    Destination port: aic-oncrpc (2786)
    [Stream index: 4]
    Sequence number: 1125    (relative sequence number)
    [Next sequence number: 1130    (relative sequence number)]
    Acknowledgment number: 599    (relative ack number)
    Header length: 20 bytes
    Flags: 0x018 (PSH, ACK)
    Window size value: 32
    [Calculated window size: 8192]
    [Window size scaling factor: 256]
    Checksum: 0x3ef5 [validation disabled]
    [SEQ/ACK analysis]
    TCP segment data (5 bytes)
[2 Reassembled TCP Segments (712 bytes): #39(707), #40(5)]
Hypertext Transfer Protocol
    HTTP/1.1 200 OK\r\n
    Date: Tue, 02 Apr 2013 01:45:58 GMT\r\n
    Server: Apache\r\n
    Set-Cookie: aq_base_sid=a27UPJlW24DjmrEBJ8i4tBkqLxs2R3SZ; PATH=/; DOMAIN=w.aq.qq.com;HttpOnly;\r\n
    Set-Cookie: aq_log_src_id=0; PATH=/; DOMAIN=w.aq.qq.com;\r\n
    Keep-Alive: timeout=5, max=99\r\n
    Connection: Keep-Alive\r\n
    Transfer-Encoding: chunked\r\n
    Content-Type: application/json; charset=utf-8\r\n
    \r\n
    HTTP chunked response
JavaScript Object Notation: application/json

No.     Time           Source                Destination           Protocol Length Info
     42 22.084181000   192.168.11.11         119.147.15.37         HTTP     438    GET /cn/mbtoken3/mbtoken3_get_uin_list?sess_id=a27UPJlW24DjmrEBJ8i4tBkqLxs2R3SZ&data=5628ECDF279A82DF0A0D38C13DACBE2905CDE736811F980293B19D8B13A0D677699402493A823BE2AF4256E416E1774AE40C0E75C37C1797E82019F5991B1F71FE1E6F2BF6E00C19D01D880C07795482E97F21A49850E1F4 HTTP/1.1 

Frame 42: 438 bytes on wire (3504 bits), 438 bytes captured (3504 bits) on interface 0
Ethernet II, Src: Promax_15:8c:1b (00:e0:66:15:8c:1b), Dst: 20:dc:e6:cb:69:5e (20:dc:e6:cb:69:5e)
Internet Protocol Version 4, Src: 192.168.11.11 (192.168.11.11), Dst: 119.147.15.37 (119.147.15.37)
Transmission Control Protocol, Src Port: aic-oncrpc (2786), Dst Port: http (80), Seq: 599, Ack: 1130, Len: 384
    Source port: aic-oncrpc (2786)
    Destination port: http (80)
    [Stream index: 4]
    Sequence number: 599    (relative sequence number)
    [Next sequence number: 983    (relative sequence number)]
    Acknowledgment number: 1130    (relative ack number)
    Header length: 20 bytes
    Flags: 0x018 (PSH, ACK)
    Window size value: 16277
    [Calculated window size: 65108]
    [Window size scaling factor: 4]
    Checksum: 0xfd93 [validation disabled]
    [SEQ/ACK analysis]
Hypertext Transfer Protocol
    [truncated] GET /cn/mbtoken3/mbtoken3_get_uin_list?sess_id=a27UPJlW24DjmrEBJ8i4tBkqLxs2R3SZ&data=5628ECDF279A82DF0A0D38C13DACBE2905CDE736811F980293B19D8B13A0D677699402493A823BE2AF4256E416E1774AE40C0E75C37C1797E82019F5991B1F71FE1E6F2BF6E00C
    User-Agent: Dalvik/1.2.0 (Linux; U; Android 2.2; sdk Build/FRF91)\r\n
    Host: w.aq.qq.com\r\n
    Connection: Keep-Alive\r\n
    \r\n
    [Full request URI [truncated]: http://w.aq.qq.com/cn/mbtoken3/mbtoken3_get_uin_list?sess_id=a27UPJlW24DjmrEBJ8i4tBkqLxs2R3SZ&data=5628ECDF279A82DF0A0D38C13DACBE2905CDE736811F980293B19D8B13A0D677699402493A823BE2AF4256E416E1774AE40C0E75C37C17]

No.     Time           Source                Destination           Protocol Length Info
     43 22.835630000   192.168.11.11         119.147.15.37         HTTP     438    [TCP Retransmission] GET /cn/mbtoken3/mbtoken3_get_uin_list?sess_id=a27UPJlW24DjmrEBJ8i4tBkqLxs2R3SZ&data=5628ECDF279A82DF0A0D38C13DACBE2905CDE736811F980293B19D8B13A0D677699402493A823BE2AF4256E416E1774AE40C0E75C37C1797E82019F5991B1F71FE1E6F2BF6E00C19D01D880C07795482E97F21A49850E1F4 HTTP/1.1 

Frame 43: 438 bytes on wire (3504 bits), 438 bytes captured (3504 bits) on interface 0
Ethernet II, Src: Promax_15:8c:1b (00:e0:66:15:8c:1b), Dst: 20:dc:e6:cb:69:5e (20:dc:e6:cb:69:5e)
Internet Protocol Version 4, Src: 192.168.11.11 (192.168.11.11), Dst: 119.147.15.37 (119.147.15.37)
Transmission Control Protocol, Src Port: aic-oncrpc (2786), Dst Port: http (80), Seq: 599, Ack: 1130, Len: 384
    Source port: aic-oncrpc (2786)
    Destination port: http (80)
    [Stream index: 4]
    Sequence number: 599    (relative sequence number)
    [Next sequence number: 983    (relative sequence number)]
    Acknowledgment number: 1130    (relative ack number)
    Header length: 20 bytes
    Flags: 0x018 (PSH, ACK)
    Window size value: 16277
    [Calculated window size: 65108]
    [Window size scaling factor: 4]
    Checksum: 0xfd93 [validation disabled]
    [SEQ/ACK analysis]
Hypertext Transfer Protocol
    [truncated] GET /cn/mbtoken3/mbtoken3_get_uin_list?sess_id=a27UPJlW24DjmrEBJ8i4tBkqLxs2R3SZ&data=5628ECDF279A82DF0A0D38C13DACBE2905CDE736811F980293B19D8B13A0D677699402493A823BE2AF4256E416E1774AE40C0E75C37C1797E82019F5991B1F71FE1E6F2BF6E00C
    User-Agent: Dalvik/1.2.0 (Linux; U; Android 2.2; sdk Build/FRF91)\r\n
    Host: w.aq.qq.com\r\n
    Connection: Keep-Alive\r\n
    \r\n
    [Full request URI [truncated]: http://w.aq.qq.com/cn/mbtoken3/mbtoken3_get_uin_list?sess_id=a27UPJlW24DjmrEBJ8i4tBkqLxs2R3SZ&data=5628ECDF279A82DF0A0D38C13DACBE2905CDE736811F980293B19D8B13A0D677699402493A823BE2AF4256E416E1774AE40C0E75C37C17]

No.     Time           Source                Destination           Protocol Length Info
     45 23.085521000   119.147.15.37         192.168.11.11         HTTP     60     HTTP/1.1 200 OK  (application/json)

Frame 45: 60 bytes on wire (480 bits), 60 bytes captured (480 bits) on interface 0
Ethernet II, Src: 20:dc:e6:cb:69:5e (20:dc:e6:cb:69:5e), Dst: Promax_15:8c:1b (00:e0:66:15:8c:1b)
Internet Protocol Version 4, Src: 119.147.15.37 (119.147.15.37), Dst: 192.168.11.11 (192.168.11.11)
Transmission Control Protocol, Src Port: http (80), Dst Port: aic-oncrpc (2786), Seq: 1462, Ack: 983, Len: 5
    Source port: http (80)
    Destination port: aic-oncrpc (2786)
    [Stream index: 4]
    Sequence number: 1462    (relative sequence number)
    [Next sequence number: 1467    (relative sequence number)]
    Acknowledgment number: 983    (relative ack number)
    Header length: 20 bytes
    Flags: 0x018 (PSH, ACK)
    Window size value: 36
    [Calculated window size: 9216]
    [Window size scaling factor: 256]
    Checksum: 0x3c20 [validation disabled]
    [SEQ/ACK analysis]
    TCP segment data (5 bytes)
[2 Reassembled TCP Segments (337 bytes): #44(332), #45(5)]
Hypertext Transfer Protocol
    HTTP/1.1 200 OK\r\n
    Date: Tue, 02 Apr 2013 01:46:00 GMT\r\n
    Server: Apache\r\n
    Set-Cookie: aq_base_sid=k3q4393QDuHxRdMoRMBUPDgsNfjLmFSZ; PATH=/; DOMAIN=w.aq.qq.com;HttpOnly;\r\n
    Keep-Alive: timeout=5, max=98\r\n
    Connection: Keep-Alive\r\n
    Transfer-Encoding: chunked\r\n
    Content-Type: application/json; charset=utf-8\r\n
    \r\n
    HTTP chunked response
JavaScript Object Notation: application/json

No.     Time           Source                Destination           Protocol Length Info
     52 48.594407000   192.168.11.11         119.147.15.37         HTTP     458    GET /cn/mbtoken3/mbtoken3_upgrade_determin_v2?uin=68159276&sess_id=a27UPJlW24DjmrEBJ8i4tBkqLxs2R3SZ&data=3C170BC265DC9C6E18CCCB7A801A2DFC68235A41672F99271F6846CC904B3700BCEE92B84424CCB1DCFD61C28CD3965198E12BCFB3DC191161666BCE47A5533B49AE5E194CC61BB91C61209443DBBD11F2D53C4F6369C9BC HTTP/1.1 

Frame 52: 458 bytes on wire (3664 bits), 458 bytes captured (3664 bits) on interface 0
Ethernet II, Src: Promax_15:8c:1b (00:e0:66:15:8c:1b), Dst: 20:dc:e6:cb:69:5e (20:dc:e6:cb:69:5e)
Internet Protocol Version 4, Src: 192.168.11.11 (192.168.11.11), Dst: 119.147.15.37 (119.147.15.37)
Transmission Control Protocol, Src Port: piccolo (2787), Dst Port: http (80), Seq: 1, Ack: 1, Len: 404
    Source port: piccolo (2787)
    Destination port: http (80)
    [Stream index: 5]
    Sequence number: 1    (relative sequence number)
    [Next sequence number: 405    (relative sequence number)]
    Acknowledgment number: 1    (relative ack number)
    Header length: 20 bytes
    Flags: 0x018 (PSH, ACK)
    Window size value: 16560
    [Calculated window size: 66240]
    [Window size scaling factor: 4]
    Checksum: 0x3c28 [validation disabled]
    [SEQ/ACK analysis]
Hypertext Transfer Protocol
    [truncated] GET /cn/mbtoken3/mbtoken3_upgrade_determin_v2?uin=68159276&sess_id=a27UPJlW24DjmrEBJ8i4tBkqLxs2R3SZ&data=3C170BC265DC9C6E18CCCB7A801A2DFC68235A41672F99271F6846CC904B3700BCEE92B84424CCB1DCFD61C28CD3965198E12BCFB3DC191161666BCE47
    User-Agent: Dalvik/1.2.0 (Linux; U; Android 2.2; sdk Build/FRF91)\r\n
    Host: w.aq.qq.com\r\n
    Connection: Keep-Alive\r\n
    \r\n
    [Full request URI [truncated]: http://w.aq.qq.com/cn/mbtoken3/mbtoken3_upgrade_determin_v2?uin=68159276&sess_id=a27UPJlW24DjmrEBJ8i4tBkqLxs2R3SZ&data=3C170BC265DC9C6E18CCCB7A801A2DFC68235A41672F99271F6846CC904B3700BCEE92B84424CCB1DCFD61C28C]

No.     Time           Source                Destination           Protocol Length Info
     55 48.794590000   119.147.15.37         192.168.11.11         HTTP     60     HTTP/1.1 200 OK  (application/json)

Frame 55: 60 bytes on wire (480 bits), 60 bytes captured (480 bits) on interface 0
Ethernet II, Src: 20:dc:e6:cb:69:5e (20:dc:e6:cb:69:5e), Dst: Promax_15:8c:1b (00:e0:66:15:8c:1b)
Internet Protocol Version 4, Src: 119.147.15.37 (119.147.15.37), Dst: 192.168.11.11 (192.168.11.11)
Transmission Control Protocol, Src Port: http (80), Dst Port: piccolo (2787), Seq: 934, Ack: 405, Len: 5
    Source port: http (80)
    Destination port: piccolo (2787)
    [Stream index: 5]
    Sequence number: 934    (relative sequence number)
    [Next sequence number: 939    (relative sequence number)]
    Acknowledgment number: 405    (relative ack number)
    Header length: 20 bytes
    Flags: 0x018 (PSH, ACK)
    Window size value: 27
    [Calculated window size: 6912]
    [Window size scaling factor: 256]
    Checksum: 0xc1ba [validation disabled]
    [SEQ/ACK analysis]
    TCP segment data (5 bytes)
[2 Reassembled TCP Segments (938 bytes): #54(933), #55(5)]
Hypertext Transfer Protocol
    HTTP/1.1 200 OK\r\n
    Date: Tue, 02 Apr 2013 01:46:25 GMT\r\n
    Server: Apache\r\n
    Set-Cookie: aq_base_sid=4i6L8BRmGH6strDgmEMv6XecycbjkUSZ; PATH=/; DOMAIN=w.aq.qq.com;HttpOnly;\r\n
    Set-Cookie: aq_log_src_id=0; PATH=/; DOMAIN=w.aq.qq.com;\r\n
    Keep-Alive: timeout=5, max=100\r\n
    Connection: Keep-Alive\r\n
    Transfer-Encoding: chunked\r\n
    Content-Type: application/json; charset=utf-8\r\n
    \r\n
    HTTP chunked response
JavaScript Object Notation: application/json

No.     Time           Source                Destination           Protocol Length Info
     62 55.951933000   192.168.11.11         119.147.15.37         HTTP     272    GET /cn/mbtoken3/mbtoken3_get_mobile_code?uin=68159276&sess_id=a27UPJlW24DjmrEBJ8i4tBkqLxs2R3SZ HTTP/1.1 

Frame 62: 272 bytes on wire (2176 bits), 272 bytes captured (2176 bits) on interface 0
Ethernet II, Src: Promax_15:8c:1b (00:e0:66:15:8c:1b), Dst: 20:dc:e6:cb:69:5e (20:dc:e6:cb:69:5e)
Internet Protocol Version 4, Src: 192.168.11.11 (192.168.11.11), Dst: 119.147.15.37 (119.147.15.37)
Transmission Control Protocol, Src Port: fryeserv (2788), Dst Port: http (80), Seq: 1, Ack: 1, Len: 218
    Source port: fryeserv (2788)
    Destination port: http (80)
    [Stream index: 6]
    Sequence number: 1    (relative sequence number)
    [Next sequence number: 219    (relative sequence number)]
    Acknowledgment number: 1    (relative ack number)
    Header length: 20 bytes
    Flags: 0x018 (PSH, ACK)
    Window size value: 16560
    [Calculated window size: 66240]
    [Window size scaling factor: 4]
    Checksum: 0xc79c [validation disabled]
    [SEQ/ACK analysis]
Hypertext Transfer Protocol
    GET /cn/mbtoken3/mbtoken3_get_mobile_code?uin=68159276&sess_id=a27UPJlW24DjmrEBJ8i4tBkqLxs2R3SZ HTTP/1.1\r\n
    User-Agent: Dalvik/1.2.0 (Linux; U; Android 2.2; sdk Build/FRF91)\r\n
    Host: w.aq.qq.com\r\n
    Connection: Keep-Alive\r\n
    \r\n
    [Full request URI: http://w.aq.qq.com/cn/mbtoken3/mbtoken3_get_mobile_code?uin=68159276&sess_id=a27UPJlW24DjmrEBJ8i4tBkqLxs2R3SZ]

No.     Time           Source                Destination           Protocol Length Info
     65 56.006041000   119.147.15.37         192.168.11.11         HTTP     60     HTTP/1.1 200 OK  (application/json)

Frame 65: 60 bytes on wire (480 bits), 60 bytes captured (480 bits) on interface 0
Ethernet II, Src: 20:dc:e6:cb:69:5e (20:dc:e6:cb:69:5e), Dst: Promax_15:8c:1b (00:e0:66:15:8c:1b)
Internet Protocol Version 4, Src: 119.147.15.37 (119.147.15.37), Dst: 192.168.11.11 (192.168.11.11)
Transmission Control Protocol, Src Port: http (80), Dst Port: fryeserv (2788), Seq: 405, Ack: 219, Len: 5
    Source port: http (80)
    Destination port: fryeserv (2788)
    [Stream index: 6]
    Sequence number: 405    (relative sequence number)
    [Next sequence number: 410    (relative sequence number)]
    Acknowledgment number: 219    (relative ack number)
    Header length: 20 bytes
    Flags: 0x018 (PSH, ACK)
    Window size value: 27
    [Calculated window size: 6912]
    [Window size scaling factor: 256]
    Checksum: 0x4a8e [validation disabled]
    [SEQ/ACK analysis]
    TCP segment data (5 bytes)
[2 Reassembled TCP Segments (409 bytes): #64(404), #65(5)]
Hypertext Transfer Protocol
    HTTP/1.1 200 OK\r\n
    Date: Tue, 02 Apr 2013 01:46:33 GMT\r\n
    Server: Apache\r\n
    Set-Cookie: aq_base_sid=gVELd3QL0JWNc6nJixH9CXqr1bUJI4SZ; PATH=/; DOMAIN=w.aq.qq.com;HttpOnly;\r\n
    Set-Cookie: aq_log_src_id=0; PATH=/; DOMAIN=w.aq.qq.com;\r\n
    Keep-Alive: timeout=5, max=100\r\n
    Connection: Keep-Alive\r\n
    Transfer-Encoding: chunked\r\n
    Content-Type: application/json; charset=utf-8\r\n
    \r\n
    HTTP chunked response
JavaScript Object Notation: application/json

No.     Time           Source                Destination           Protocol Length Info
     72 95.794762000   192.168.11.11         119.147.15.37         HTTP     361    GET /cn/mbtoken3/mbtoken3_verify_mobile_code?uin=68159276&sess_id=a27UPJlW24DjmrEBJ8i4tBkqLxs2R3SZ&data=4C23ED2B6F2949E4A09680BCB02C8AC4FDA9FC031C4D7B656DEF168FE6C76F5FD416743E069C644D HTTP/1.1 

Frame 72: 361 bytes on wire (2888 bits), 361 bytes captured (2888 bits) on interface 0
Ethernet II, Src: Promax_15:8c:1b (00:e0:66:15:8c:1b), Dst: 20:dc:e6:cb:69:5e (20:dc:e6:cb:69:5e)
Internet Protocol Version 4, Src: 192.168.11.11 (192.168.11.11), Dst: 119.147.15.37 (119.147.15.37)
Transmission Control Protocol, Src Port: media-agent (2789), Dst Port: http (80), Seq: 1, Ack: 1, Len: 307
    Source port: media-agent (2789)
    Destination port: http (80)
    [Stream index: 7]
    Sequence number: 1    (relative sequence number)
    [Next sequence number: 308    (relative sequence number)]
    Acknowledgment number: 1    (relative ack number)
    Header length: 20 bytes
    Flags: 0x018 (PSH, ACK)
    Window size value: 16560
    [Calculated window size: 66240]
    [Window size scaling factor: 4]
    Checksum: 0xb807 [validation disabled]
    [SEQ/ACK analysis]
Hypertext Transfer Protocol
    GET /cn/mbtoken3/mbtoken3_verify_mobile_code?uin=68159276&sess_id=a27UPJlW24DjmrEBJ8i4tBkqLxs2R3SZ&data=4C23ED2B6F2949E4A09680BCB02C8AC4FDA9FC031C4D7B656DEF168FE6C76F5FD416743E069C644D HTTP/1.1\r\n
    User-Agent: Dalvik/1.2.0 (Linux; U; Android 2.2; sdk Build/FRF91)\r\n
    Host: w.aq.qq.com\r\n
    Connection: Keep-Alive\r\n
    \r\n
    [Full request URI: http://w.aq.qq.com/cn/mbtoken3/mbtoken3_verify_mobile_code?uin=68159276&sess_id=a27UPJlW24DjmrEBJ8i4tBkqLxs2R3SZ&data=4C23ED2B6F2949E4A09680BCB02C8AC4FDA9FC031C4D7B656DEF168FE6C76F5FD416743E069C644D]

No.     Time           Source                Destination           Protocol Length Info
     75 96.153839000   119.147.15.37         192.168.11.11         HTTP     60     HTTP/1.1 200 OK  (application/json)

Frame 75: 60 bytes on wire (480 bits), 60 bytes captured (480 bits) on interface 0
Ethernet II, Src: 20:dc:e6:cb:69:5e (20:dc:e6:cb:69:5e), Dst: Promax_15:8c:1b (00:e0:66:15:8c:1b)
Internet Protocol Version 4, Src: 119.147.15.37 (119.147.15.37), Dst: 192.168.11.11 (192.168.11.11)
Transmission Control Protocol, Src Port: http (80), Dst Port: media-agent (2789), Seq: 347, Ack: 308, Len: 5
    Source port: http (80)
    Destination port: media-agent (2789)
    [Stream index: 7]
    Sequence number: 347    (relative sequence number)
    [Next sequence number: 352    (relative sequence number)]
    Acknowledgment number: 308    (relative ack number)
    Header length: 20 bytes
    Flags: 0x018 (PSH, ACK)
    Window size value: 27
    [Calculated window size: 6912]
    [Window size scaling factor: 256]
    Checksum: 0xa893 [validation disabled]
    [SEQ/ACK analysis]
    TCP segment data (5 bytes)
[2 Reassembled TCP Segments (351 bytes): #74(346), #75(5)]
Hypertext Transfer Protocol
    HTTP/1.1 200 OK\r\n
    Date: Tue, 02 Apr 2013 01:47:13 GMT\r\n
    Server: Apache\r\n
    Set-Cookie: aq_base_sid=bj18SOTgO0ruw5MFRBaxt9zFQGQySqSZ; PATH=/; DOMAIN=w.aq.qq.com;HttpOnly;\r\n
    Keep-Alive: timeout=5, max=100\r\n
    Connection: Keep-Alive\r\n
    Transfer-Encoding: chunked\r\n
    Content-Type: application/json; charset=utf-8\r\n
    \r\n
    HTTP chunked response
JavaScript Object Notation: application/json

No.     Time           Source                Destination           Protocol Length Info
     77 96.353650000   192.168.11.11         119.147.15.37         HTTP     605    GET /cn/mbtoken3/mbtoken3_bind_token_by_app?aq_base_sid=a27UPJlW24DjmrEBJ8i4tBkqLxs2R3SZ&uin=68159276&mobile=&data=1923D8191926F20E2947584845B75F75FF2090BE0AFA735E0DE74AE25A16CE8F87F8E2DEFCA2E4ADA7E3B76B77BC29D853537FACB3A35E6A99EACF42D2BDCA9B76F7DEAA9B42700BD33D6659D00203B5DC83FA22FA3F9B2946B3FE43DA631488C137B2B35163814486423F665BC1EB5FC1A58C4176E7B300A515A665C27CCE896D91DF5AA9B88D61DDBD3FADD990DFA511139FFD4C8DB22B&is_dna=1 HTTP/1.1 

Frame 77: 605 bytes on wire (4840 bits), 605 bytes captured (4840 bits) on interface 0
Ethernet II, Src: Promax_15:8c:1b (00:e0:66:15:8c:1b), Dst: 20:dc:e6:cb:69:5e (20:dc:e6:cb:69:5e)
Internet Protocol Version 4, Src: 192.168.11.11 (192.168.11.11), Dst: 119.147.15.37 (119.147.15.37)
Transmission Control Protocol, Src Port: media-agent (2789), Dst Port: http (80), Seq: 308, Ack: 352, Len: 551
    Source port: media-agent (2789)
    Destination port: http (80)
    [Stream index: 7]
    Sequence number: 308    (relative sequence number)
    [Next sequence number: 859    (relative sequence number)]
    Acknowledgment number: 352    (relative ack number)
    Header length: 20 bytes
    Flags: 0x018 (PSH, ACK)
    Window size value: 16472
    [Calculated window size: 65888]
    [Window size scaling factor: 4]
    Checksum: 0x3fe7 [validation disabled]
    [SEQ/ACK analysis]
Hypertext Transfer Protocol
    [truncated] GET /cn/mbtoken3/mbtoken3_bind_token_by_app?aq_base_sid=a27UPJlW24DjmrEBJ8i4tBkqLxs2R3SZ&uin=68159276&mobile=&data=1923D8191926F20E2947584845B75F75FF2090BE0AFA735E0DE74AE25A16CE8F87F8E2DEFCA2E4ADA7E3B76B77BC29D853537FACB3A35E6A
    User-Agent: Dalvik/1.2.0 (Linux; U; Android 2.2; sdk Build/FRF91)\r\n
    Host: w.aq.qq.com\r\n
    Connection: Keep-Alive\r\n
    \r\n
    [Full request URI [truncated]: http://w.aq.qq.com/cn/mbtoken3/mbtoken3_bind_token_by_app?aq_base_sid=a27UPJlW24DjmrEBJ8i4tBkqLxs2R3SZ&uin=68159276&mobile=&data=1923D8191926F20E2947584845B75F75FF2090BE0AFA735E0DE74AE25A16CE8F87F8E2DEFCA2E4AD]

No.     Time           Source                Destination           Protocol Length Info
     80 96.652795000   119.147.15.37         192.168.11.11         HTTP     60     HTTP/1.1 200 OK  (application/json)

Frame 80: 60 bytes on wire (480 bits), 60 bytes captured (480 bits) on interface 0
Ethernet II, Src: 20:dc:e6:cb:69:5e (20:dc:e6:cb:69:5e), Dst: Promax_15:8c:1b (00:e0:66:15:8c:1b)
Internet Protocol Version 4, Src: 119.147.15.37 (119.147.15.37), Dst: 192.168.11.11 (192.168.11.11)
Transmission Control Protocol, Src Port: http (80), Dst Port: media-agent (2789), Seq: 788, Ack: 859, Len: 5
    Source port: http (80)
    Destination port: media-agent (2789)
    [Stream index: 7]
    Sequence number: 788    (relative sequence number)
    [Next sequence number: 793    (relative sequence number)]
    Acknowledgment number: 859    (relative ack number)
    Header length: 20 bytes
    Flags: 0x018 (PSH, ACK)
    Window size value: 32
    [Calculated window size: 8192]
    [Window size scaling factor: 256]
    Checksum: 0xa4ae [validation disabled]
    [SEQ/ACK analysis]
    TCP segment data (5 bytes)
[2 Reassembled TCP Segments (441 bytes): #79(436), #80(5)]
Hypertext Transfer Protocol
    HTTP/1.1 200 OK\r\n
    Date: Tue, 02 Apr 2013 01:47:14 GMT\r\n
    Server: Apache\r\n
    Set-Cookie: aq_log_src_id=0; PATH=/; DOMAIN=w.aq.qq.com;\r\n
    Keep-Alive: timeout=5, max=99\r\n
    Connection: Keep-Alive\r\n
    Transfer-Encoding: chunked\r\n
    Content-Type: application/json; charset=utf-8\r\n
    \r\n
    HTTP chunked response
JavaScript Object Notation: application/json

No.     Time           Source                Destination           Protocol Length Info
     89 99.952171000   192.168.11.11         119.147.15.37         HTTP     435    GET /cn/mbtoken3/mbtoken3_exchange_key_v2?mobile_type=4&client_type=2&client_ver=15&local_id=0&config_ver=100&pub_key=ADC982CF331AA0ECA591180495C6F42D0C0936AB69AB7DDC11925090FC4D85EECAFD6A647F3C962B73C180332D706D4D5601EBFF73CF99815FC47C11EAC7D801&sys_ver=2.2 HTTP/1.1 

Frame 89: 435 bytes on wire (3480 bits), 435 bytes captured (3480 bits) on interface 0
Ethernet II, Src: Promax_15:8c:1b (00:e0:66:15:8c:1b), Dst: 20:dc:e6:cb:69:5e (20:dc:e6:cb:69:5e)
Internet Protocol Version 4, Src: 192.168.11.11 (192.168.11.11), Dst: 119.147.15.37 (119.147.15.37)
Transmission Control Protocol, Src Port: media-agent (2789), Dst Port: http (80), Seq: 859, Ack: 793, Len: 381
    Source port: media-agent (2789)
    Destination port: http (80)
    [Stream index: 7]
    Sequence number: 859    (relative sequence number)
    [Next sequence number: 1240    (relative sequence number)]
    Acknowledgment number: 793    (relative ack number)
    Header length: 20 bytes
    Flags: 0x018 (PSH, ACK)
    Window size value: 16362
    [Calculated window size: 65448]
    [Window size scaling factor: 4]
    Checksum: 0xcde5 [validation disabled]
    [SEQ/ACK analysis]
Hypertext Transfer Protocol
    [truncated] GET /cn/mbtoken3/mbtoken3_exchange_key_v2?mobile_type=4&client_type=2&client_ver=15&local_id=0&config_ver=100&pub_key=ADC982CF331AA0ECA591180495C6F42D0C0936AB69AB7DDC11925090FC4D85EECAFD6A647F3C962B73C180332D706D4D5601EBFF73CF9
